{
  "recall_case_id": "recall-case-20260518-001",
  "scope_type": "SKU",
  "scope_id": "sku-gf-rice-001",
  "reason": "Recall review requires stop-sale until approved release.",
  "owner_approval_ref": {
    "ownerDecisionId": "owner-decision-20260518-001"
  },
  "evidence_refs": [
    {
      "evidenceId": "evidence-sale-lock-20260518-001",
      "evidenceStatus": "ACCEPTED",
      "scope": "sale-lock"
    }
  ]
}
